{
  "schema_version": 1,
  "profiles": {
    "default": "fast"
  },
  "dictionary": [
    {
      "term": "Codex",
      "phrases": ["codex", "code x", "扣带思"],
      "weight": 8,
      "scope": "both",
      "enabled": true
    },
    {
      "term": "Claude Code",
      "phrases": ["claude code", "cloud code"],
      "weight": 7,
      "scope": "default",
      "enabled": true
    }
  ],
  "bindings": {
    "mouse.side_front.press": "toggle_recording",
    "mouse.side_rear.press": "trigger_secondary_action",
    "hotkey.record_toggle": "toggle_recording"
  },
  "transcriber": {
    "backend": "funasr_onnx",
    "model_name": "iic/SenseVoiceSmall",
    "language": "auto"
  },
  "input": {
    "front_button": "x1",
    "rear_button": "x2",
    "record_hotkey_keycodes": [42, 125, 193],
    "gesture_trigger_button": "rear"
  },
  "output": {
    "enter_mode": "enter",
    "auto_paste": false,
    "translation_toast_enabled": false,
    "readback_tts_enabled": false,
    "readback_tts_voice": "en-US-EmmaMultilingualNeural"
  },
  "startup": {
    "prewarm_on_start": true
  },
  "logs": {
    "level": "info"
  }
}
